{
  "artifact_type": "BenchmarkInputManifest",
  "schema_version": "1.0",
  "benchmark_id": "CUMCM-2025D",
  "attachments": [
    {
      "attachment_id": "problem_statement",
      "required": true,
      "status": "PRESENT",
      "path": "D:\\MathModel-DE-Skill\\benchmarks\\2025D\\inputs\\D题.pdf",
      "sha256": "280d690a1f78f5ff0889760592bf30de903ac5144ed8491d59ae744e560c4aa8",
      "media_type": "application/pdf"
    },
    {
      "attachment_id": "attachment_1",
      "required": true,
      "status": "PRESENT",
      "path": "D:\\MathModel-DE-Skill\\benchmarks\\2025D\\inputs\\附件1.xlsx",
      "sha256": "769b2cec2981ee655fa37ea13708442830bb42e19d74e7e40fa7809bbdc8b3eb",
      "media_type": "application/vnd.openxmlformats-officedocument.spreadsheetml.sheet"
    },
    {
      "attachment_id": "attachment_2",
      "required": true,
      "status": "PRESENT",
      "path": "D:\\MathModel-DE-Skill\\benchmarks\\2025D\\inputs\\附件2.xlsx",
      "sha256": "77ae841ebc62df2773de46a083b05aa95bc8111ca5c7fc62786c77a0501b068a",
      "media_type": "application/vnd.openxmlformats-officedocument.spreadsheetml.sheet"
    },
    {
      "attachment_id": "attachment_3_result1-1",
      "required": true,
      "status": "PRESENT",
      "path": "D:\\MathModel-DE-Skill\\benchmarks\\2025D\\inputs\\附件3\\result1-1.xlsx",
      "sha256": "cfa9bd89ca6c3c5976470a658af577e2c0ac0da98b488fb8e0fe2fae9f44d6bc",
      "media_type": "application/vnd.openxmlformats-officedocument.spreadsheetml.sheet"
    },
    {
      "attachment_id": "attachment_3_result1-2",
      "required": true,
      "status": "PRESENT",
      "path": "D:\\MathModel-DE-Skill\\benchmarks\\2025D\\inputs\\附件3\\result1-2.xlsx",
      "sha256": "cfa9bd89ca6c3c5976470a658af577e2c0ac0da98b488fb8e0fe2fae9f44d6bc",
      "media_type": "application/vnd.openxmlformats-officedocument.spreadsheetml.sheet"
    },
    {
      "attachment_id": "attachment_3_result2-1",
      "required": true,
      "status": "PRESENT",
      "path": "D:\\MathModel-DE-Skill\\benchmarks\\2025D\\inputs\\附件3\\result2-1.xlsx",
      "sha256": "ede188f310c06379cc4a325648265a7b20b83e6e00c1ac7c3cd9358deb90f97d",
      "media_type": "application/vnd.openxmlformats-officedocument.spreadsheetml.sheet"
    },
    {
      "attachment_id": "attachment_3_result2-2",
      "required": true,
      "status": "PRESENT",
      "path": "D:\\MathModel-DE-Skill\\benchmarks\\2025D\\inputs\\附件3\\result2-2.xlsx",
      "sha256": "fe9bf025f32f14f1a50d547fac16480ac049dde84302105000d225bde21b3fc6",
      "media_type": "application/vnd.openxmlformats-officedocument.spreadsheetml.sheet"
    },
    {
      "attachment_id": "attachment_3_result3-1",
      "required": true,
      "status": "PRESENT",
      "path": "D:\\MathModel-DE-Skill\\benchmarks\\2025D\\inputs\\附件3\\result3-1.xlsx",
      "sha256": "cfa9bd89ca6c3c5976470a658af577e2c0ac0da98b488fb8e0fe2fae9f44d6bc",
      "media_type": "application/vnd.openxmlformats-officedocument.spreadsheetml.sheet"
    },
    {
      "attachment_id": "attachment_3_result3-2",
      "required": true,
      "status": "PRESENT",
      "path": "D:\\MathModel-DE-Skill\\benchmarks\\2025D\\inputs\\附件3\\result3-2.xlsx",
      "sha256": "cfa9bd89ca6c3c5976470a658af577e2c0ac0da98b488fb8e0fe2fae9f44d6bc",
      "media_type": "application/vnd.openxmlformats-officedocument.spreadsheetml.sheet"
    },
    {
      "attachment_id": "attachment_3_result4-1",
      "required": true,
      "status": "PRESENT",
      "path": "D:\\MathModel-DE-Skill\\benchmarks\\2025D\\inputs\\附件3\\result4-1.xlsx",
      "sha256": "0a7f570ce4ced26d0199406389fe47ac58a0bbf980775bae3d097c4f391eb166",
      "media_type": "application/vnd.openxmlformats-officedocument.spreadsheetml.sheet"
    },
    {
      "attachment_id": "attachment_3_result4-2",
      "required": true,
      "status": "PRESENT",
      "path": "D:\\MathModel-DE-Skill\\benchmarks\\2025D\\inputs\\附件3\\result4-2.xlsx",
      "sha256": "144c0ceed4b93bce8efbbc05823204108cf07735b23c57445b5124c89c3fac1f",
      "media_type": "application/vnd.openxmlformats-officedocument.spreadsheetml.sheet"
    }
  ]
}